{
  "spec_id": "product.kernel",
  "title": "Reference Product Kernel",
  "purpose": "Defines the minimal Level 0 kernel foundations for the reference repository.",
  "status": "accepted",
  "schema_version": "1",
  "level": 0,
  "normative_requirements": [
    {
      "id": "REF-KERNEL-001",
      "text": "The reference product kernel shall expose `kernel_identity()` and return `reference-kernel`."
    }
  ],
  "dependencies": [],
  "references": [
    {
      "type": "artifact",
      "path": "docs/overview/REFERENCE-OVERVIEW.md"
    },
    {
      "type": "artifact",
      "path": "docs/plans/01-reference-repository-plan.md"
    }
  ],
  "supersedes": [],
  "superseded_by": [],
  "derived_artifacts": [
    {
      "type": "markdown",
      "path": "derived/specs/product/level-0/kernel.md"
    }
  ],
  "correspondence": {
    "implementations": [
      {
        "id": "kernel-impl",
        "paths": [
          "src/product/kernel.py"
        ],
        "requirements": [
          "REF-KERNEL-001"
        ]
      }
    ],
    "tests": [
      {
        "id": "kernel-test",
        "paths": [
          "tests/test_kernel.py"
        ],
        "requirements": [
          "REF-KERNEL-001"
        ]
      }
    ],
    "conformance": [
      {
        "requirement_id": "REF-KERNEL-001",
        "implementation_ids": [
          "kernel-impl"
        ],
        "test_ids": [
          "kernel-test"
        ],
        "status": "covered"
      }
    ]
  }
}
